[
  {
    "organization": "org:ministerie-van-algemene-zaken",
    "fiscalYear": 2025,
    "unit": "EUR x 1,000",
    "current": {
      "spendingBudget": 117978,
      "spendingActual": 118473,
      "revenue": 13827,
      "net": 104646,
      "nonprofit": null
    },
    "previous": {
      "spendingBudget": 115134,
      "spendingActual": 118111,
      "revenue": 9083,
      "net": 109028,
      "nonprofit": null
    },
    "history": [
      {
        "fiscalYear": 2013,
        "spendingActual": 59280,
        "revenue": 9216
      },
      {
        "fiscalYear": 2014,
        "spendingActual": 59520,
        "revenue": 6390
      },
      {
        "fiscalYear": 2015,
        "spendingActual": 60588,
        "revenue": 6732
      },
      {
        "fiscalYear": 2016,
        "spendingActual": 59327,
        "revenue": 6558
      },
      {
        "fiscalYear": 2017,
        "spendingActual": 61570,
        "revenue": 6200
      },
      {
        "fiscalYear": 2018,
        "spendingActual": 64473,
        "revenue": 6150
      },
      {
        "fiscalYear": 2019,
        "spendingActual": 66433,
        "revenue": 6340
      },
      {
        "fiscalYear": 2020,
        "spendingActual": 75196,
        "revenue": 6680
      },
      {
        "fiscalYear": 2021,
        "spendingActual": 82341,
        "revenue": 7085
      },
      {
        "fiscalYear": 2022,
        "spendingActual": 83622,
        "revenue": 9400
      },
      {
        "fiscalYear": 2023,
        "spendingActual": 92522,
        "revenue": 8955
      },
      {
        "fiscalYear": 2024,
        "spendingActual": 118111,
        "revenue": 9083
      }
    ],
    "sources": [
      {
        "source": "src:rijksfinancien-begrotingsstaten-2013-2027",
        "retrieved": "2026-09-18",
        "confidence": "high"
      }
    ]
  },
  {
    "organization": "org:ministerie-van-algemene-zaken",
    "fiscalYear": 2026,
    "unit": "EUR x 1,000",
    "current": {
      "spendingBudget": 117087,
      "spendingActual": null,
      "revenue": 10084,
      "net": 107003,
      "nonprofit": null
    },
    "previous": {
      "spendingBudget": 117978,
      "spendingActual": 118473,
      "revenue": 13827,
      "net": 104646,
      "nonprofit": null
    },
    "history": [],
    "sources": [
      {
        "source": "src:rijksfinancien-begrotingsstaten-2013-2027",
        "retrieved": "2026-09-18",
        "confidence": "high"
      },
      {
        "source": "src:rijksfinancien-mjn-2027-bijlage-2",
        "retrieved": "2026-09-18",
        "confidence": "high"
      }
    ]
  },
  {
    "organization": "org:ministerie-van-algemene-zaken",
    "fiscalYear": 2027,
    "unit": "EUR x 1,000",
    "current": {
      "spendingBudget": 112663,
      "spendingActual": null,
      "revenue": 9511,
      "net": 103152,
      "nonprofit": null
    },
    "previous": {
      "spendingBudget": 117087,
      "spendingActual": null,
      "revenue": 10084,
      "net": 107003,
      "nonprofit": null
    },
    "history": [],
    "sources": [
      {
        "source": "src:rijksfinancien-begrotingsstaten-2013-2027",
        "retrieved": "2026-09-18",
        "confidence": "high"
      },
      {
        "source": "src:rijksfinancien-mjn-2027-bijlage-2",
        "retrieved": "2026-09-18",
        "confidence": "high"
      }
    ]
  },
  {
    "organization": "org:ministerie-van-binnenlandse-zaken-en-koninkrijksrelaties",
    "fiscalYear": 2025,
    "unit": "EUR x 1,000",
    "current": {
      "spendingBudget": 14450301,
      "spendingActual": 13449283,
      "revenue": 2709250,
      "net": 10740033,
      "nonprofit": null
    },
    "previous": {
      "spendingBudget": 11770724,
      "spendingActual": 11137469,
      "revenue": 1320658,
      "net": 9816811,
      "nonprofit": null
    },
    "history": [
      {
        "fiscalYear": 2013,
        "spendingActual": 1117216,
        "revenue": 201725
      },
      {
        "fiscalYear": 2014,
        "spendingActual": 1415567,
        "revenue": 594967
      },
      {
        "fiscalYear": 2015,
        "spendingActual": 1208268,
        "revenue": 939931
      },
      {
        "fiscalYear": 2016,
        "spendingActual": 1199950,
        "revenue": 263558
      },
      {
        "fiscalYear": 2017,
        "spendingActual": 1233661,
        "revenue": 209145
      },
      {
        "fiscalYear": 2018,
        "spendingActual": 6576480,
        "revenue": 1397284
      },
      {
        "fiscalYear": 2019,
        "spendingActual": 5813234,
        "revenue": 808864
      },
      {
        "fiscalYear": 2020,
        "spendingActual": 7813270,
        "revenue": 985719
      },
      {
        "fiscalYear": 2021,
        "spendingActual": 9460816,
        "revenue": 1091484
      },
      {
        "fiscalYear": 2022,
        "spendingActual": 7650004,
        "revenue": 875689
      },
      {
        "fiscalYear": 2023,
        "spendingActual": 9759944,
        "revenue": 1148573
      },
      {
        "fiscalYear": 2024,
        "spendingActual": 11137469,
        "revenue": 1320658
      }
    ],
    "sources": [
      {
        "source": "src:rijksfinancien-begrotingsstaten-2013-2027",
        "retrieved": "2026-09-18",
        "confidence": "high"
      }
    ]
  },
  {
    "organization": "org:ministerie-van-binnenlandse-zaken-en-koninkrijksrelaties",
    "fiscalYear": 2026,
    "unit": "EUR x 1,000",
    "current": {
      "spendingBudget": 14567828,
      "spendingActual": null,
      "revenue": 2903308,
      "net": 11664520,
      "nonprofit": null
    },
    "previous": {
      "spendingBudget": 14450301,
      "spendingActual": 13449283,
      "revenue": 2709250,
      "net": 10740033,
      "nonprofit": null
    },
    "history": [],
    "sources": [
      {
        "source": "src:rijksfinancien-begrotingsstaten-2013-2027",
        "retrieved": "2026-09-18",
        "confidence": "high"
      },
      {
        "source": "src:rijksfinancien-mjn-2027-bijlage-2",
        "retrieved": "2026-09-18",
        "confidence": "high"
      }
    ]
  },
  {
    "organization": "org:ministerie-van-binnenlandse-zaken-en-koninkrijksrelaties",
    "fiscalYear": 2027,
    "unit": "EUR x 1,000",
    "current": {
      "spendingBudget": 15163420,
      "spendingActual": null,
      "revenue": 2333107,
      "net": 12830313,
      "nonprofit": null
    },
    "previous": {
      "spendingBudget": 14567828,
      "spendingActual": null,
      "revenue": 2903308,
      "net": 11664520,
      "nonprofit": null
    },
    "history": [],
    "sources": [
      {
        "source": "src:rijksfinancien-begrotingsstaten-2013-2027",
        "retrieved": "2026-09-18",
        "confidence": "high"
      },
      {
        "source": "src:rijksfinancien-mjn-2027-bijlage-2",
        "retrieved": "2026-09-18",
        "confidence": "high"
      }
    ]
  },
  {
    "organization": "org:ministerie-van-buitenlandse-zaken",
    "fiscalYear": 2025,
    "unit": "EUR x 1,000",
    "current": {
      "spendingBudget": 16948865,
      "spendingActual": 17005709,
      "revenue": 2635699,
      "net": 14370010,
      "nonprofit": null
    },
    "previous": {
      "spendingBudget": 15411546,
      "spendingActual": 15281254,
      "revenue": 3785675,
      "net": 11495579,
      "nonprofit": null
    },
    "history": [
      {
        "fiscalYear": 2013,
        "spendingActual": 11615400,
        "revenue": 839053
      },
      {
        "fiscalYear": 2014,
        "spendingActual": 13326376,
        "revenue": 876000
      },
      {
        "fiscalYear": 2015,
        "spendingActual": 13134196,
        "revenue": 916071
      },
      {
        "fiscalYear": 2016,
        "spendingActual": 12991738,
        "revenue": 1491953
      },
      {
        "fiscalYear": 2017,
        "spendingActual": 11185549,
        "revenue": 3972313
      },
      {
        "fiscalYear": 2018,
        "spendingActual": 12245171,
        "revenue": 1285313
      },
      {
        "fiscalYear": 2019,
        "spendingActual": 13599232,
        "revenue": 864280
      },
      {
        "fiscalYear": 2020,
        "spendingActual": 14337057,
        "revenue": 971570
      },
      {
        "fiscalYear": 2021,
        "spendingActual": 15314969,
        "revenue": 1055653
      },
      {
        "fiscalYear": 2022,
        "spendingActual": 16558347,
        "revenue": 1439490
      },
      {
        "fiscalYear": 2023,
        "spendingActual": 16049278,
        "revenue": 1475364
      },
      {
        "fiscalYear": 2024,
        "spendingActual": 15281254,
        "revenue": 3785675
      }
    ],
    "sources": [
      {
        "source": "src:rijksfinancien-begrotingsstaten-2013-2027",
        "retrieved": "2026-09-18",
        "confidence": "high"
      }
    ]
  },
  {
    "organization": "org:ministerie-van-buitenlandse-zaken",
    "fiscalYear": 2026,
    "unit": "EUR x 1,000",
    "current": {
      "spendingBudget": 20860245,
      "spendingActual": null,
      "revenue": 4727008,
      "net": 16133237,
      "nonprofit": null
    },
    "previous": {
      "spendingBudget": 16948865,
      "spendingActual": 17005709,
      "revenue": 2635699,
      "net": 14370010,
      "nonprofit": null
    },
    "history": [],
    "sources": [
      {
        "source": "src:rijksfinancien-begrotingsstaten-2013-2027",
        "retrieved": "2026-09-18",
        "confidence": "high"
      },
      {
        "source": "src:rijksfinancien-mjn-2027-bijlage-2",
        "retrieved": "2026-09-18",
        "confidence": "high"
      }
    ]
  },
  {
    "organization": "org:ministerie-van-buitenlandse-zaken",
    "fiscalYear": 2027,
    "unit": "EUR x 1,000",
    "current": {
      "spendingBudget": 21659361,
      "spendingActual": null,
      "revenue": 1821283,
      "net": 19838078,
      "nonprofit": null
    },
    "previous": {
      "spendingBudget": 20860245,
      "spendingActual": null,